{
  "schema_version": 1, "provider_id": "manjaro", "display_name": "Manjaro", "homepage_url": "https://manjaro.org/download/", "driver": "static-json",
  "allowed_hosts": ["manjaro.org", "download.manjaro.org", "gitlab.manjaro.org"],
  "capabilities": {"products": ["manjaro"], "editions": ["gnome", "kde", "xfce"], "flavors": ["full", "minimal"], "architectures": ["x86_64"], "languages": [], "channels": ["stable", "review", "preview"]},
  "release_sources": [
    {"source_id": "stable-full", "metadata_url": "https://manjaro.org/products/download/x86", "artifact_regex": "^manjaro-(?P<edition>gnome|kde|xfce)-(?P<version>\\d+(?:\\.\\d+)+)-(?P<build>\\d{6})-(?P<kernel>linux\\d+)\\.iso$", "identity": {"product_id": "manjaro", "flavor": "full", "channel": "stable", "architecture": "x86_64"}, "download": {"strategy": "page-link", "link_regex": "^https://download\\.manjaro\\.org/.+\\.iso$"}, "verification": {"level": "CHECKSUM", "checksum": {"algorithm": "sha256", "strategy": "sidecar", "suffix": ".sha256"}}},
    {"source_id": "stable-minimal", "metadata_url": "https://gitlab.manjaro.org/webpage/iso-info/-/raw/master/file-info.json", "artifact_regex": "^manjaro-(?P<edition>gnome|kde|xfce)-(?P<version>\\d+(?:\\.\\d+)+)-minimal-(?P<build>\\d{6})-(?P<kernel>linux\\d+)\\.iso$", "identity": {"product_id": "manjaro", "flavor": "minimal", "channel": "stable", "architecture": "x86_64"}, "download": {"strategy": "page-link", "link_regex": "^https://download\\.manjaro\\.org/.+\\.iso$"}, "verification": {"level": "CHECKSUM", "checksum": {"algorithm": "sha256", "strategy": "sidecar", "suffix": ".sha256"}}},
    {"source_id": "review", "metadata_url": "https://gitlab.manjaro.org/applications/manjaro-get-iso", "artifact_regex": "^manjaro-(?P<edition>gnome|kde|xfce)-(?P<version>\\d+(?:\\.\\d+)+-rc\\d+)(?:-(?P<minimal>minimal))?-(?P<build>\\d{6})-(?P<kernel>linux\\d+)\\.iso$", "identity": {"product_id": "manjaro", "channel": "review", "architecture": "x86_64"}, "download": {"strategy": "page-link", "link_regex": "^https://download\\.manjaro\\.org/.+\\.iso$"}, "verification": {"level": "CHECKSUM", "checksum": {"algorithm": "sha256", "strategy": "sidecar", "suffix": ".sha256"}}},
    {"source_id": "preview", "metadata_url": "https://gitlab.manjaro.org/applications/manjaro-get-iso", "artifact_regex": "^manjaro-(?P<edition>gnome|kde|xfce)-.+\\.iso$", "identity": {"product_id": "manjaro", "channel": "preview", "architecture": "x86_64"}, "download": {"strategy": "page-link", "link_regex": "^https://download\\.manjaro\\.org/.+\\.iso$"}, "verification": {"level": "CHECKSUM", "checksum": {"algorithm": "sha256", "strategy": "sidecar", "suffix": ".sha256"}}}
  ],
  "detection": [
    {"regex": "^manjaro-(?P<edition>gnome|kde|xfce)-(?P<version>\\d+(?:\\.\\d+)+)-(?P<build>\\d{6})-(?P<kernel>linux\\d+)\\.iso$", "identity": {"product_id": "manjaro", "edition": "$group:edition", "flavor": "full", "channel": "stable", "architecture": "x86_64", "version": "$group:version", "build": "$group:build"}, "downloadable": true},
    {"regex": "^manjaro-(?P<edition>gnome|kde|xfce)-(?P<version>\\d+(?:\\.\\d+)+)-minimal-(?P<build>\\d{6})-(?P<kernel>linux\\d+)\\.iso$", "identity": {"product_id": "manjaro", "edition": "$group:edition", "flavor": "minimal", "channel": "stable", "architecture": "x86_64", "version": "$group:version", "build": "$group:build"}, "downloadable": true},
    {"regex": "^manjaro-(?P<edition>gnome|kde|xfce)-(?P<version>\\d+(?:\\.\\d+)+-rc\\d+)-(?P<build>\\d{6})-(?P<kernel>linux\\d+)\\.iso$", "identity": {"product_id": "manjaro", "edition": "$group:edition", "flavor": "full", "channel": "review", "architecture": "x86_64", "version": "$group:version", "build": "$group:build"}, "downloadable": true},
    {"regex": "^manjaro-(?P<edition>gnome|kde|xfce)-(?P<version>\\d+(?:\\.\\d+)+-rc\\d+)-minimal-(?P<build>\\d{6})-(?P<kernel>linux\\d+)\\.iso$", "identity": {"product_id": "manjaro", "edition": "$group:edition", "flavor": "minimal", "channel": "review", "architecture": "x86_64", "version": "$group:version", "build": "$group:build"}, "downloadable": true}
  ],
  "notes": ["Stable full images use Manjaro's official download page; minimal images use its iso-info file-info.json feed. Both publish per-ISO SHA-256 sidecars.", "Review and preview filenames do not reliably encode a stable migration target; they require a persisted catalog mapping before updates are enabled."]
}
