{
  "schema_version": 1, "provider_id": "zorin-os", "display_name": "Zorin OS", "homepage_url": "https://zorin.com/os/", "driver": "latest-redirect",
  "allowed_hosts": ["zorin.com", "help.zorin.com", "zrn.co", "mirror.dogado.de"],
  "capabilities": {"products": ["zorin-os"], "editions": ["Core", "Education", "Lite", "Pro", "Pro-Lite"], "flavors": [], "architectures": ["x86_64"], "languages": [], "channels": ["stable"]},
  "release_sources": [
    {"source_id": "core", "metadata_url": "https://help.zorin.com/docs/getting-started/check-the-integrity-of-your-copy-of-zorin-os/", "artifact_regex": "^Zorin-OS-(?P<version>\\d+(?:\\.\\d+)+)-Core-64-bit(?:-r(?P<build>\\d+))?\\.iso$", "identity": {"product_id": "zorin-os", "edition": "Core", "channel": "stable", "architecture": "x86_64"}, "download": {"strategy": "latest-redirect", "url_template": "https://zrn.co/{major}core64"}, "verification": {"level": "CHECKSUM", "checksum": {"algorithm": "sha256", "strategy": "html-table", "url_template": "https://help.zorin.com/docs/getting-started/check-the-integrity-of-your-copy-of-zorin-os/", "entry_regex": "(?P<checksum>[A-Fa-f0-9]{64})"}}},
    {"source_id": "education", "metadata_url": "https://help.zorin.com/docs/getting-started/check-the-integrity-of-your-copy-of-zorin-os/", "artifact_regex": "^Zorin-OS-(?P<version>\\d+(?:\\.\\d+)+)-Education-64-bit(?:-r(?P<build>\\d+))?\\.iso$", "identity": {"product_id": "zorin-os", "edition": "Education", "channel": "stable", "architecture": "x86_64"}, "download": {"strategy": "latest-redirect", "url_template": "https://zrn.co/{major}education64"}, "verification": {"level": "CHECKSUM", "checksum": {"algorithm": "sha256", "strategy": "html-table", "url_template": "https://help.zorin.com/docs/getting-started/check-the-integrity-of-your-copy-of-zorin-os/", "entry_regex": "(?P<checksum>[A-Fa-f0-9]{64})"}}},
    {"source_id": "lite", "metadata_url": "https://help.zorin.com/docs/getting-started/getting-zorin-os-lite/", "artifact_regex": "^Zorin-OS-(?P<version>\\d+(?:\\.\\d+)+)-Lite-64-bit(?:-r(?P<build>\\d+))?\\.iso$", "identity": {"product_id": "zorin-os", "edition": "Lite", "channel": "stable", "architecture": "x86_64"}, "download": {"strategy": "page-link", "link_regex": "^https://zrn\\.co/\\d+lite64$"}, "verification": {"level": "CHECKSUM", "checksum": {"algorithm": "sha256", "strategy": "html-table", "url_template": "https://help.zorin.com/docs/getting-started/check-the-integrity-of-your-copy-of-zorin-os/", "entry_regex": "(?P<checksum>[A-Fa-f0-9]{64})"}}}
  ],
  "detection": [
    {"regex": "^Zorin-OS-(?P<version>\\d+(?:\\.\\d+)+)-(?P<edition>Core|Education|Lite)-64-bit(?:-r(?P<build>\\d+))?\\.iso$", "identity": {"product_id": "zorin-os", "edition": "$group:edition", "channel": "stable", "architecture": "x86_64", "version": "$group:version", "build": "$group:build"}, "downloadable": true},
    {"regex": "^Zorin-OS-(?P<version>\\d+(?:\\.\\d+)+)-(?P<edition>Pro|Pro-Lite)-64-bit(?:-r(?P<build>\\d+))?\\.iso$", "identity": {"product_id": "zorin-os", "edition": "$group:edition", "channel": "stable", "architecture": "x86_64", "version": "$group:version", "build": "$group:build"}, "downloadable": false}
  ],
  "notes": ["Only Core, Education and Lite are downloadable. Pro and Pro Lite are detection-only and never trigger login or purchase automation."]
}
